{
  "idea": {
    "schema": "magi/idea@1",
    "id": "miax-options-volume",
    "asset": "miax",
    "title": "Miami International Holdings: can earnings keep growing after the volatility spike?",
    "summary": "Miami International Holdings runs a group of US options exchanges, together with smaller futures, equities and international venues. Most of its income comes from US options: it charges a transaction fee on each contract it matches and pays part of it back to market makers as liquidity rebates, so the business is judged on net revenue, the fees left after those payments. Access and port fees and market data fees add a recurring stream that does not depend on trading volume. Costs are largely fixed, so higher volume falls mostly to profit, and the balance sheet carries net cash and almost no debt. In 2026 options volume rose with market volatility, while the share count grew sharply after the 2025 listing and warrant exercises. This idea tracks three questions over the next 12 to 18 months: whether transaction revenue and market share hold up once volatility falls back; whether access and market data revenue keep growing on their own; and whether share-count growth stops, so that profit growth reaches earnings per share.",
    "status": "active",
    "created_by": "pendragon.avalon",
    "created_at": "2026-10-25T10:03:11Z",
    "created_via_issue": 55,
    "thread": 56
  },
  "latest_close": {
    "value": 33.630001068115234,
    "currency": "USD",
    "date": "2026-10-30",
    "source": "yahoo"
  },
  "views": [
    {
      "schema": "magi/view@1",
      "idea": "miax-options-volume",
      "actor": "pendragon.avalon",
      "position": "neutral",
      "strategy": "unpriced-quality-growth",
      "horizon_months": 14,
      "distribution": {
        "form": "points",
        "points": [
          {
            "price": 21.09,
            "p": 0.1
          },
          {
            "price": 25.55,
            "p": 0.1
          },
          {
            "price": 33.36,
            "p": 0.2
          },
          {
            "price": 43.49,
            "p": 0.2
          },
          {
            "price": 52.35,
            "p": 0.2
          },
          {
            "price": 62.16,
            "p": 0.1
          },
          {
            "price": 75.18,
            "p": 0.1
          }
        ]
      },
      "tails": {
        "left": "thin",
        "right": "thin"
      },
      "confidence": 0.5,
      "pillars": [
        {
          "id": "operating-leverage",
          "claim": "Exchange costs are largely fixed, so higher volume falls mostly to profit: second-quarter 2026 net revenue rose 35% year over year and adjusted EBITDA 57%, with the adjusted EBITDA margin at 54% against 47%.",
          "weight": 2,
          "evidence": [
            "ev-20261025-miax-2026q2-results"
          ]
        },
        {
          "id": "recurring-fees",
          "claim": "Access fees and market data fees, which do not depend on trading volume, grew to $34.9 million and $12.2 million in the second quarter, up 34% and 19% year over year, a source of growth beyond market volatility.",
          "weight": 2,
          "evidence": [
            "ev-20261025-miax-2026q2-10q"
          ]
        },
        {
          "id": "net-cash",
          "claim": "Cash of $660.5 million against debt of $1.5 million at 30 June 2026 means the downside does not run through financing or credit.",
          "weight": 1,
          "evidence": [
            "ev-20261025-miax-2026q2-10q"
          ]
        },
        {
          "id": "volatility-volume",
          "claim": "The company attributes the 25% rise in options volume to elevated market volatility, and options market share slipped to 16.5% from 16.7% a year earlier; part of the volume gain should reverse when volatility falls.",
          "weight": -2,
          "evidence": [
            "ev-20261025-miax-2026q2-results"
          ]
        },
        {
          "id": "dilution",
          "claim": "The diluted share count rose to 110.7 million from 78.5 million a year earlier, so adjusted earnings per share were flat at $0.48 despite 57% growth in adjusted EBITDA.",
          "weight": -2,
          "evidence": [
            "ev-20261025-miax-2026q2-results",
            "ev-20261025-miax-2026q2-10q"
          ]
        }
      ],
      "evidence_stances": [
        {
          "evidence": "ev-20261025-miax-2026q2-results",
          "stance": 1,
          "note": "Operating leverage is confirmed and expense guidance was lowered; the company attributes the volume gain to volatility."
        },
        {
          "evidence": "ev-20261025-miax-2026q2-10q",
          "stance": 0,
          "note": "Recurring fees and net cash support the view; the 41% rise in diluted shares works against it."
        }
      ],
      "methodology": "excalibur",
      "methodology_fit": [
        {
          "criterion": "c0-trading",
          "assessment": "met",
          "note": "Listed on the New York Stock Exchange since August 2025 and trading normally; no offer, scheme or take-private has been announced."
        },
        {
          "criterion": "c1-engine",
          "assessment": "partial",
          "note": "Of the four tests, the business model passes: costs are largely fixed, the second-quarter adjusted EBITDA margin was 54% and net capture per options contract rose to $0.124 from $0.117. The other three fall short. US options trade on many exchanges owned by several groups, so the engine is not unique and its market share moves from quarter to quarter; its results show no gains from AI or other new technology beyond its own trading platform; and parallel competitors cap how far it can re-rate."
        },
        {
          "criterion": "c2-unpriced",
          "assessment": "unmet",
          "note": "The shares trade well below larger exchange groups on enterprise value to adjusted EBITDA, but most of that discount looks rational rather than a framing error. Transaction revenue is about 62% of net revenue, so earnings follow trading volume more closely than at peers with larger data, clearing and listing businesses; options market share edged down; and the diluted share count grew 41% in a year. Our expected price is above today's because we expect 2027 EBITDA to grow on the 2026 base and share issuance to stop. That is a forecast difference, not a mispricing that the market will correct once a framing is cleared up."
        },
        {
          "criterion": "c3-helmsman",
          "assessment": "met",
          "note": "Thomas Gallagher, chairman since 2008 and chief executive since 2012, still runs the company he built; Lance Emmons has been chief financial officer since 2020."
        },
        {
          "criterion": "c4-incentives",
          "assessment": "unmet",
          "note": "Equity awards are time-vesting stock options and restricted stock with no share-price hurdle. Over the past year the officers have sold and not bought; part of the selling came from exercising options that expired in August 2026, so it is not all discretionary. The only open-market purchases were three small ones, about 16,800 shares between December 2025 and March 2026, by accounts managed by Horizon Kinetics, whose chief executive Murray Stahl is a director; his Form 4 filings state that he does not exercise investment discretion over those accounts."
        },
        {
          "criterion": "c5-catalyst",
          "assessment": "partial",
          "note": "The next dated reading is the third-quarter 2026 results in early November, the first after the volatility peak. It is dated, but it does not by itself point the price up. The end of share issuance would support the price, but it has no date."
        },
        {
          "criterion": "c6-floor",
          "assessment": "met",
          "note": "Net cash of about $659 million is about $5.95 a diluted share, roughly 17% of the price, and debt is $1.5 million. In our conservative case, in which volatility falls back and options market share drops to about 15%, the cash-generating core still supports a value well above zero, below today's price, without any need for financing."
        }
      ],
      "rationale": "Initial view: standing aside. Our distribution for the price at the end of 2027 is centred above today's price, because exchange costs are largely fixed, access and market data fees keep growing apart from trading volume, and we expect share issuance to stop so that profit growth reaches earnings per share. Excalibur, however, keeps a company only when its discount is a framing error that can be corrected, and here most of the discount looks like a rational price for an engine that depends on options volume, competes with parallel exchanges and has been issuing shares quickly (c2 unmet). The engine also fails the uniqueness test, and management incentives are not tied to the share price. We therefore record our price forecast without taking a position. We will reassess after the third-quarter 2026 results in early November. If transaction revenue keeps growing year over year after the volatility peak, options market share stays above 16% and the diluted share count stops rising, the case would rest on more than our forecast. If transaction revenue falls year over year or market share drops below 15.5%, our conservative case becomes more likely and the distribution will move down.",